<?xml version="1.0"?>
<studenti xmlns:xsi="http://www.w3.org/2001/XMLSchema-instance" xsi:noNamespaceSchemaLocation="studenti.xsd"><studente><nome>Pietro</nome><cognome>Nardelli</cognome><email>pietro.nardelliz@gmail.com</email><materie><materia status="unplanned"><nomeMateria>Prova</nomeMateria></materia></materie><riassunti><creati><riassuntoIDCreato materiaRiassunto="Prova">5</riassuntoIDCreato><riassuntoIDCreato materiaRiassunto="Prova">6</riassuntoIDCreato><riassuntoIDCreato materiaRiassunto="Prova">7</riassuntoIDCreato></creati><visualizzati/><preferiti><riassuntoIDPreferito>5</riassuntoIDPreferito></preferiti></riassunti><reputation>0</reputation><coins>0</coins></studente></studenti>
